Id,Naughtiness,Author,SpecialOptions,es-es,en-us,ca
496,2,,,Yo nunca me he grabado mientras cagaba.,Never have I ever recorded myself while pooping.,Jo mai m'he gravat mentre cagava.
497,5,Anónimo,,Yo nunca lo he hecho en un sitio público.,Never have I ever had sex in a public place.,Jo mai ho he fet en un lloc públic.
498,5,Anónimo,,Yo nunca lo he hecho en unos probadores.,Never have I ever had sex in a fitting room.,Jo mai ho he fet en uns emprovadors d'una botiga.
499,5,Anónimo,,Yo nunca lo he hecho en un coche.,Never have I ever had sex in a car.,Jo mai ho he fet en un cotxe.
500,2,Anónimo,,Yo nunca he sido pillado/a llegando borracho/a a casa.,Never have I ever been caught coming home drunk.,Jo mai he estat pillat arribant begut a casa.
501,2,Anónimo,,Yo nunca he sido detenido/a.,Never have I ever been detained.,Jo mai he estat detingut/da.
502,1,Anónimo,,Yo nunca me he tropezado por mirar el móvil.,Never have I ever stumbled because of looking at my cell phone.,Jo mai m'he xocat amb alguna cosa per mirar el mòbil.
503,1,Anónimo,,Yo nunca he llorado viendo una película.,Never have I ever cried while watching a movie.,Jo mai he plorat al veure una película.
504,4,Clara,,Yo nunca me he gastado más de 50€ para intentar tener sexo.,Never have I ever spent more than 50$ trying yo get laid.,Jo mai m'he gastat més de 50€ per intentar tenir sexe.
505,3,,,Yo nunca he tenido problemas para encontrar el clítoris.,Never have I ever had troubles finding the clitoris.,Jo mai he tingut problemes per a trobar el clítoris.
506,4,Gisu,,Yo nunca he ido a clase borracho/a.,Never have I ever assisted a class drunk.,Jo mai he anat a classe begut/da.
507,3,,,Yo nunca he mandado un nude por error.,Never have I ever sent nudes by mistake.,Jo mai he enviat nudes per error.
508,4,,,Yo nunca me he despertado borracho a la mañana siguiente.,Never have I ever waken up still drunk.,Jo mai m'he llevat i seguía begut.
509,2,,,Yo nunca me he enamorado a primera vista.,Never have I ever fallen in love first sight.,Jo mai m'he enamorat a primera vista.
510,3,Una paja sin fin,,Yo nunca me he hecho una paja delfín.,Never have I ever done a never-ending handjob.,Jo mai m'he fet una palla dofí.
511,5,,,Yo nunca he visto un micropene.,Never have I ever seen a micropenis.,Jo mai he vist un micropenis.
512,3,Giss,,Yo nunca he follado con alguien calvo.,Never have I ever fucked with someone bold.,Jo mai he follat amb algú calb.
513,3,Giss,,Yo nunca me he acostado con alguien 5 años menor que yo.,Never have I ever slept with someone 5 years younger than me.,Jo mai he follat amb algú 5 anys menor que jo.
514,1,Clara,,Yo nunca he conocido al creador de Drink and Play.,Never have I ever met the creator of Drink and Play.,Jo mai he conegut al creador de Drink and Play.
515,3,Giss,,Yo nunca me he liado con dos personas con el mismo nombre.,Never have I ever made out with two people with the same name.,Jo mai m'he liat amb dues persones amb el mateix nom.
516,5,Clara,,Yo nunca me he acostado con dos gemelos/as.,Never have I ever slept with two twins.,Jo mai he follat amb dos bessons.
517,5,,,Yo nunca he tenido un accidente en la cama.,Never have I ever had an accident in the bed.,Jo mai he tingut un accident al llit.
518,3,Clara,,Yo nunca he pensado seriamente en hacerme OnlyFans.,Never have I ever seriously considered creating an OnlyFans account.,Jo mai m'he plantejat seriament crear-me un compte d'OnlyFans.
519,2,,,Yo nunca he pensado que le gusto a alguien de los presentes.,Never have I ever thought that someone present liked me.,Jo mai he pensat que li agrado a algú present.
520,3,,,Yo nunca he pillado a alguien de los presentes mirandome las partes.,Never have I ever caught someone present looking at my parts.,Jo mai he pillat a algú present mirant-me les parts.
521,3,B,,Yo nunca he intentado poner celoso/a a mi pareja.,Never have I ever tried to make jealous my partner.,Jo mai he intentat posar gelós/a a la meva parella.
522,5,B,,Yo nunca he pensado que estaba en una relación tóxica.,Never have I ever thought that I was in a toxic relationship.,Jo mai he pensat que estava en una relació tòxica.
523,2,Clara,,Yo nunca he querido irme de esta fiesta.,Never have I ever desired leaving this party.,Jo mai he desitjat marxar d'aquesta festa.
524,4,MrEspecifico,,Yo nunca me he comido o me han comido la polla después de meterse una raya encima de la misma.,Never have I ever eaten a dick or my dick has been eaten after putting a line on it.,A mi mai m'han menjat o he menjat una polla després de fer-se una ratlla a sobre.
525,5,,,Yo nunca me he masturbado en clase,Never have I ever masturbated during a lesson.,Jo mai m'he masturbat durant una classe.
526,1,,,Yo nunca he aprovechado la pandemia para cambiar mi peinado.,,
527,1,,,Yo nunca me he rapado al cero.,,
528,2,,,Yo nunca he pensado en matar a alguien.,,
529,1,,,Yo nunca he abierto Google en mitad de un examen.,,
530,1,,,Yo nunca he empezado una relación durante la cuarentena.,,
531,2,,,"Yo nunca he puesto ""aquí por la cuarentena"" en mi descripción de Tinder.",,
532,1,,,Yo nunca me he hecho Tinder durante la cuarentena.,,
533,2,,,Yo nunca he llamado a mi pareja por le nombre de mi ex.,,
534,1,,,Yo nunca he sacado la ropa sucia del cesto para ponermela,,
535,2,,,Yo nunca he probado la comida de animales.,,
536,3,,,Yo nunca he masturbado a alguien delante de un espejo.,,
537,3,,,Yo nunca me he olvidado de quitarme la copa para follar.,,
538,1,,,Yo nunca he llevado la copa puesta más de 24h.,,
539,2,,,Yo nunca he sido llevado dentro del carrito de la compra como adulto.,,
540,5,,,Yo nunca he tenido sexo en una sala con una lavadora.,,
541,3,,,Yo nunca he tenido sexo con una musica de los 80 de fondo.,,
542,2,,,Yo nunca he usado una frase para ligar sacada de internet.,,
543,1,,,Yo nunca he empezado a estudiar un examen a menos de una hora de empezarlo.,,
544,1,,,Yo nunca me he creado una cuenta para stalkear.,,
545,1,,,Yo nunca he ligado jugando a videojuegos.,,
546,2,,,Yo nunca he puesto una excusa (falsa) para evitar quedar con alguien.,,
547,3,,,Yo nunca he fantaseado sexualmente con algun/a cantante pop.,,
548,2,,,Yo nunca he estado jugando a videojuegos en mitad de una clase online.,,
549,1,,,Yo nunca me he dejado el micro abierto durante una clase online.,,
550,2,,,Yo nunca he mentido sobre que tocaba un instrumento para ligar.,,
551,2,,,Yo nunca he pensado que el Covid-19 era una conspiración.,,
552,2,,,Yo nunca he vuelto a casa con un ojo morado.,,
553,4,Steve,,Yo nunca he apuñalado a alguien más de 23 veces en una misma noche.,,
554,1,,,Yo nunca me he montado un gimnasio en casa durante la pandemia.,,
555,1,,,Yo nunca he tenido una estatuilla de buda en casa.,,
556,1,,,Yo nunca nunca he matado a una planta sin querer.,,
557,1,,,Yo nunca he meado fuera a pesar de estar meando sentado.,,
558,1,,,Yo nunca he tirado el tampón en el váter sin querer.,,
559,1,,,Yo nunca he tirado el rollo de papel de váter en el váter.,,
560,1,,,A mi nunca me han pedido que deje que me toquen el pelo.,,
561,1,,,Yo nunca he criado caracoles,,
562,2,,,Yo nunca he discutido con mis padres porque no les gustaba mi pareja,,
563,1,,,Yo nunca he editado un vídeo con música de Avicii,,
564,2,,,Yo nunca he recibido un balazo.,,
565,2,,,A mi nunca me han disparado en USA.,,
566,1,,,Yo nunca he pensado en entrar en el ejército.,,
567,4,,,Yo nunca he pensado que moriría de sobredosis.,,
568,2,,,Yo nunca me he lavado los dientes con un cepillo ajeno.,,
569,2,,,Yo nunca he pensado en dejar de salir con este grupo.,,
570,1,,,Yo nunca he pintado un graffiti,,
571,1,,,Yo nunca me he liado con alguien en un campamento,,
572,3,,,Yo nunca he besado al hemano/a de alguno de los presentes,,
573,2,,,Yo nunca he querido irme de casa,,
574,2,,,Yo nunca le he puesto un mote tierno a un rollo de una noche.,,
575,1,,,Yo nunca me he enganchado a una serie,,
576,1,,,"Yo nunca he quedao con alguien para ""Netflix and chill"" y resultó ser solo Netflix and chill",,
577,1,,,Yo nunca me he disfrazado de un personaje de alicia en el país de las maravillas.,,
578,3,,,Yo nunca he probado algún videojuego erótico.,,
579,1,,,"Yo nunca me he vestido al estilo ""Peaky Blinders""",,
580,1,,,Yo nunca he salido de fiesta con tirantes y un sombrero.,,
581,1,,,Yo nunca he comprobado si en el hemisferio sur el váter gira al revés.,,
582,3,,,Yo nunca he tenido un gatillazo,,
583,2,,,Yo nunca he tenido un crush en Zendaya,,
584,2,,,Yo nunca he tenido un crush en una persona que me caía mal,,
585,4,,,Yo nunca he formado parte de una estafa piramidal,,
586,3,,,Yo nunca he tenido sexo con un bailarín/a profesional.,,
587,1,,,A mi nunca se me ha roto un móvil nuevo en menos de una semana.,,
588,1,,,Yo nunca he perdido un móvil nuevo.,,
589,1,,,Yo nunca me he depilado mi propio culo.,,
590,1,,,Yo nunca he llamado a la policia.,,
591,2,,,Yo nunca me he quedado dormido al volante.,,
592,2,,,Yo nunca he comprado dos entradas para un concierto y he terminado yendo solo.,,
593,1,,,Yo nunca he tenido un crush en Zac Efron,,
594,4,,,Yo nunca he hecho un puente en un coche.,,
595,3,,,Yo nunca he tenido una galería de imágenes porno.,,
596,1,,,Yo nunca he querido ir a un instituto americano.,,
597,1,,,Yo nunca he abierto la puerta de mi casa en ropa interior.,,
598,2,,,Yo nunca he estado desnudo sin importarme que pudieran verme los vecinos.,,
599,3,,,Yo nunca he echado un polvo durante un apagón,,
600,3,,,Yo nunca me he liado con alguien en un ascensor.,,
601,1,,,Yo nunca he subido una foto donde yo salía bien y sabía que mi amig@ no.,,
602,4,,,Yo nunca me he emborrachado en solitario.,,
603,3,,,Yo nunca me he liado con alguien que pensaba que era tremendamente feo/a.,,
604,2,,,"Yo nunca he dicho ""te quiero"" sin sentirlo.",,
605,5,,,Yo nunca me he sentido atraído por el dolor.,,
606,2,,,Yo nunca he intentado escalar la pared de un edificio.,,
607,1,,,Yo nunca he llevado relleno en las tetas o en el paquete.,,
608,5,,,A mi nunca se me ha inflamado el coño de tanto tocarme.,,
609,3,,,A mi nunca me han dejado insatisfecho/a.,,
610,2,,,Yo nunca he pensado en operarme las tetas.,,
611,2,,,Yo nunca he ocultado que tenía Covid,,
612,2,,,Yo nunca me he inventado que tenía Covid,,
613,3,,,Yo nunca me he saltado el confinamiento para follar,,
614,2,,,Yo nunca he sido multado por saltarme el confinamiento,,
615,5,,,Yo nunca he usado una app para ligar para masturbarme,,
616,3,,,Yo nunca he follado durante una clase online,,
617,1,,,Yo nunca me he ido de erasmus/intercambio,,
618,2,,,Yo nunca he puesto los cuernos estando de erasmus/intercambio,,
619,1,,,Yo nunca he creído ver un OVNI,,
620,2,,,Yo nunca he pensado que mi ex tenía que pagarme terapia,,
621,1,,,Yo nunca he creído en el oroscopo,,
622,5,,,Yo nunca he querído follarme al padre/madre de uno de los presentes,,
623,2,,,Yo nunca he deseado tener otros suegros,,
624,1,,,Yo nunca me he caído en bici,,
625,2,,,Yo nunca he plantado marihuana,,
626,1,,,Yo nunca he comprado lencería,,
627,2,,,Yo nuna he escondido juguetes sexuales,,
628,3,,,Yo nunca he follado por el culo para evitar un embarazo,,
629,2,,,Yo nunca he pensado que la culpa de todo es el capitalismo,,
630,1,,,Yo nunca he tenido una arma de fuego,,
631,2,,,Yo nunca he comprado una arma de fuego,,
632,2,,,Yo nunca he matado a un mamífero,,
633,1,,,Yo nunca he querído ser veterinario/a.,,
634,1,,,Yo nunca he picado un mechero,,
635,2,,,Yo nunca he llevado mechero para ligar a pesar de no fumar.,,
636,1,,,Yo nunca he perdido un vuelo.,,
637,1,,,Yo nunca he visto Harry Potter,,
638,1,,,Yo nunca he visto Star Wars,,
639,1,,,Yo nunca he visto El Señor de Los Anillos,,
640,1,,,Yo nunca me he quedado dormido/aa en una fiesta,,
641,1,,,Yo nunca he pensado que yo podria hacer un cuadro de arte abstracto,,
642,1,,,Yo nunca he limpiado una mancha de sangre.,,
643,1,,,Yo nunca me he planteado ser maquillador de muertos.,,
644,2,,,A mi nunca me han lanzado una zapatilla.,,
645,1,,,Yo nunca he cagado en la montaña.,,
646,1,,,Yo nunca he plantado una planta,,
647,2,,,Yo nunca he tenido a un/a sirviente/a,,
648,1,,,Yo nunca he trabajado de camarero/a,,
649,1,,,Yo nunca he pagado por un concierto,,
650,3,,,Yo nunca he pensado que la copa menstrual era un cóctel.,,
651,1,,,Yo nunca he ido a Murcia.,,
652,1,,,Yo nunca he intentado imitar el acento del sur.,,
653,2,,,Yo nunca he regalado a alguien un regalo que originalmente era para mi.,,
654,1,,,Yo nunca he tenido un Nokia.,,
655,1,,,Yo nunca he montado un caballo.,,
656,2,,,Yo nunca he utilizado ropa interior de hombre por ser más cómoda.,,
657,3,,,Yo nunca me he liado con alguien mayor de edad siendo yo menor de edad.,Never have I ever hooked up with an adult while I was a teenager.,Jo mai m'he embolicat amb algú menor d'edat mentre jo no ho era.
658,5,,,Yo nunca me he masturbado viendo el perfil de Instagram de alguien,,
659,4,,,Yo nunca he querido participar en un ritual de ayahuasca.,,
660,4,,,Yo nunca me he meado en la cama con alguien al lado.,,
661,4,,,A mi nunca se me ha salido una teta en público.,,
662,4,,,Yo nunca he atascado un retrete ajeno,,
663,4,,,Yo nunca me he puesto cachondo viendo un videoclip de reggaeton,,
664,4,,,Yo nunca he meado con la tapa bajada,,