Id,Naughtiness,es-es,en-us
1,1,Yo nunca me he quedado dormido follando.,Never have I ever fallen asleep during sex
2,1,Yo nunca me he partido un diente de fiesta.>a>Dentista<a<,Never have I ever had a tooth broken in a party>a>Dentista<a<
3,1,Yo nunca he tenido un blancazo/pálida.,Never have I ever passed out partying
4,1,Yo nunca he montado una escena tras fumar marihuana.,Never have I ever made a scene after smoking weed
5,1,Yo nunca he montado una escena borracho.,Never have I ever made a scene being drunk
6,2,Yo nunca he follado con la misma persona que otra persona en el grupo>a>Steve<a<,Never have I ever had sex with the same person as someone else in this group>a>Steve<a<
7,2,Yo nunca he tenido sexo mientras fumaba>a>Steve<a<,Never have I ever smoked during sex>a>Steve<a<
8,2,Yo nunca he tenido sexo fumado.,Never have I ever had sex while being high
9,2,Yo nunca he conduido un Tesla>a>Allen<a<,Never have I ever driven a Tesla>a>Allen<a<
10,2,Yo nunca he hecho paracaidismo>a>Allen<a<,Never have I ever done skydiving>a>Allen<a<
11,5,Yo nunca me he acostado con algun familiar de un amigo>a>Carolina<a<,Never have I ever slept with a friend's relative>a>Carolina<a<
12,5,Yo nunca he mentido sobre mi nacionalidad para tener sexo>a>Allen<a<,Never have I ever lied about my nationality to flirt with someone>a>Allen<a<
13,5,Yo nunca me he acostado con alguien sin saber su nombre>a>Poy<a<,Never have I ever slept with someone whose name I didn't know>a>Poy<a<
14,5,Yo nunca me he liado con alguien sin saber su nombre.,Never have I ever made out with someone whose name I didn't know
15,5,Yo nunca he mentido sobre mi edad para acostarme con alguien.,Never have I ever had sex with someone to who I lied about my age
16,5,Yo nunca he mentido sobre mi edad para ligar con alguien.,Never have I ever lied about my age to flirt with someone
17,5,Yo nunca he tenido un rollo de una noche.,Never have I ever had a one-night-stand
18,5,Yo nunca me he acostado con alguien que he conocido en Tinder.,Never have I ever slept with someone I met on Tinder
19,5,Yo nunca me he follado a un caballo>a>Allen<a<,Never have I ever fucked a horse>a>Allen<a<
20,5,Yo nunca me he follado a un animal>a>Steve<a<,Never have I ever fucked a non human being>a>Steve<a<
21,5,Yo nunca he besado a un a un animal con lengua>a>Steve<a<,Never have I ever made out with an animal>a>Steve<a<
22,5,Yo nunca he follado con un familiar en la misma habitación>a>Steve<a<,Never have I ever had sex while a relative of mine was in the room>a>Steve<a<
23,5,Yo nunca he sido pillado teniendo sexo>a>Steve<a<,Never have I ever been caught while having sex>a>Steve<a<
24,5,Yo nunca he sido pillado teniendo masturbandome>a>Steve<a<,Never have I ever been caught touching myself>a>Steve<a<
25,5,Yo nunca he pillado a mis padres teniendo sexo>a>Steve<a<,Never have I ever caught my parents doing it>a>Steve<a<
26,5,Yo nunca me he acostado con alguien con más de 10 años de diferencia>a>Steve<a<,Never have I ever slept with someone with who I had a 10 years difference (or more)>a>Steve<a<
27,5,Yo nunca me he liado con alguien con más de 10 años de diferencia conmigo.>a>Steve<a<,Never have I ever made out with someone with who I had a 10 or more years difference
28,5,Yo nunca he probado la cocaína,Never have I ever tried cocaine
29,5,Yo nunca he hecho un trio.,Never have I ever had a threesome
,,he acampado en la montaña.,
,,he dormido en la playa,
,,he okupado un hogar,
,1,he montado en camello,
,,he hecho sandboard,
,,he hecho surf,
,,he practicado esquí,
,,he nadado con tiburones,
,,he destrozado una almohada,
,,he roto la cama,
,,he besado a la persona equivocada,
,,he comido demasiado picante,
,,he pedido un tenedor en un restaurante chino,
,,he prendido fuego en la cocina,
,,me he quemado con el horno,
,,he colgado una bandera en mi cuarto que no es de mi país,
,,he probado hasta donde me entraba un dildo,
,,he usado utensilios domésticos como dildo,
,,me he tocado con la vibración del móvil,
,,he afeitado las partes intimas de otra persona,
,,me he afeitado las partes intimas,
,,he comprado en una tienda erótica,
,,he ido a la trabajo/escuela sin ropa interior,
,,he ido al trabajo/escuela con la ropa al revés,
,,he bebido de una lata-cenicero,
,,me he confundido de droga,
,,he visto a uno de mis padres drogado,
,,he fumado en compañía de un familiar,
,,he derribado una puerta,
,,he saltado por encima de una fogata,
,,he roto un teclado o mando jugando a videojuegos,
,,he agredido a un policia,
,,he hecho una barricada,
,,he quemado mobiliario publico,
,,he participado en una manifestacion,
,,he sido amenazado de muerte,
,,he estado en la carcel,
,,he estado detenido,
,,he sido pillado con drogas encima,
,,he matado a un mosquito,
,,he tenido la regla cuando no tocaba,
,,he tenido un susto de embarazo,
,,me he meado encima,
,,he meado en un lugar público,
,,he intentado cantar una canción que no sabía,
,,he cantado el himno nacional de un país que no sea el mío,
,,he visto una luna roja,
,,me he hecho pasar por extranjero,
,,he lanzado un huevo contra algo,
,,he sido sido golpeado por un huevo,
,,he emborrachado a alguien,
,,he influenciado a alguien para que fume,
,,he dicho que dejaría de fumar y no lo he hecho,
,,me he duchado con alguien que no sea de mi familia,
,,he intentado provocar que dos personas ligaran,
,,me he caído en la piscina accidentalmente,
,,me he bañado en la piscina en invierrno,
,,he fingido ser el novio de alguien,
,,he suspendido en la autoescuela,
,,me he planteado si era bisexual,
,,he puesto dinero en juegos de apuestas,
,,he teido un crush en un profesor/a,
,,he espiado en los vestidores del sexo que me atrae,
,,me he perreado a mi mismo delante del espejo,
,,he bailado pensando que nadie me veía pero no era así,
,,he suspendido un examen de lengua por falta de ortografía,
,,he abierto una pizza del revés,
,,he dormido 24h seguidas,
,,he roto vajilla,
,,he tenido la conversación de la cigueña con mis padres o mis hijos,
,,he roto el movil de una caída,
,,he pedido a una persona del sexo que me atrae que me enseñe a besar como excusa para liarme,
,,me he liado con alguien menor de edad,
,,lo he hecho con alguien menor de edad,
,,me he equivocado de agujero,
,,he follado en público,
,,he roto un condón,