Id,Naughtiness,Author,SpecialOptions,es-es,en-us,ca
169,4,,,Yo nunca he conducido borracho o drogado.,Never have I ever driven drunk or drugged.,Jo mai he conduït borratxo o drogat.
170,2,,,Yo nunca he gritado al ver a un famoso.,Never have I ever screamed when seeing a celebrity.,Jo mai he cridat en veure a un famós.
171,3,,,Yo nunca me ha puesto cachondo un profesor/a.,Never have I ever been horny because of a teacher.,Jo mai m'ha posat catxondo un professor/a.
172,5,,,Yo nunca me haría un trio con dos de los presentes.,Never have I ever wanted a thresome with two people present now.,Jo mai em faria un trio amb dos dels presents.
173,2,,,Yo nunca me he bañado desnudo/a en la playa.,Never have I ever swum naked on the beach.,Jo mai m'he banyat nu/a a la platja.
174,3,,,Yo nunca he follado con la tele de fondo.,Never have I ever fucked with the TV on ,Jo mai he follat ​​amb la tele de fons.
175,4,,,Yo nunca he sido arrestado por llevar marihuana.,Never have I ever been arrested for carrying marijuana.,Jo mai he estat arrestat per portar marihuana.
176,3,,,Yo nunca me he liado con alguien para joder a un tercero.,Never have I ever hooked up with someone to fuck a third person,Jo mai m'he embolicat amb algú per fotre a un tercer.
177,3,,,Yo nunca he stalkeado a alguien aqui presente.,Never have I ever stalked someone in here,Jo mai he stalkeado a algú aqui present.
178,3,,,Yo nunca he tenido que parar el polvo por culpa de las lentillas/gafas.,Never have I ever had to stop sex because of my glasses or lenses,Jo mai he hagut de parar a mitges per culpa de les lents de contacte / ulleres.
179,5,,,Yo nunca he visto porno que involucre tentaculos.,Never have I ever seen porn that involves tentacles.,Jo mai he vist porno que involucri tentacles.
180,2,,,Yo nunca he deseado ser del sexo contrario.,Never have I ever wanted to be of the opposite sex.,Jo mai he desitjat ser de el sexe contrari.
181,3,,,Yo nunca he dejado a alguien a medias.,Never have I ever left anyone unfinished,Jo mai he deixat a algú a mitges.
182,2,,,Yo nunca he tenido una erección en educación física.,Never have I ever had an erection during physical education.,Jo mai he tingut una erecció en educació física.
183,3,,,Yo nunca he tenido una erección en el vestuario.,Never have I ever had an erection in the locker room.,Jo mai he tingut una erecció al vestidor.
184,3,,,Yo nunca me he fijado demasiado en alguien en los vestuarios.,Never have I ever stared too much at someone in the locker room.,Jo mai m'he fixat massa en algú als vestidors.
185,2,,,Yo nunca he tenido un crush en la hermana/hermano de mis amigos.,Never have I ever had a crush on the sister / brother of a friend,Jo mai he tingut un crush en la germana o germà d'un dels meus amics.
186,2,,,Yo nunca me he liado con alguien dentro de una iglesia.,Never have I ever made out with someone inside a church.,Jo mai m'he embolicat amb algú dins d'una església.
187,3,,,Yo nunca me he corrido sin avisar.,Never have I ever came without warning.,Jo mai m'he corregut sense avisar.
188,5,,,Yo nunca he intentado tragar corrida y no he podido.,Never have I ever tried to swallow cum but I couldn't,Jo mai he intentat empassar correguda i no he pogut.
189,5,,,Yo nunca he hecho una garganta profunda.,Never have I ever done a deep-throat,Jo mai he fet una gola profunda.
190,5,,,Yo nunca he jugado a la galleta.,Never have I ever played the cookie game,Jo mai he jugat a la galeta.
191,2,,,Yo nunca he dado una nota con mi numero de telefono.,Never have I ever passed my phone in a paper note,Jo mai he donat una nota amb el meu número de telèfon.
192,2,,,Yo nunca he ligado con un camarero/a.,Never have I ever hooked up with a waiter/waitress.,Jo mai he lligat amb un cambrer/a.
193,2,,,Yo nunca he ligado siendo un camarero/a.,Never have I ever hooked up while working as waiter/waitress.,Jo mai he lligat sent un cambrer/a.
194,2,,,Yo nunca he pensado que moriria virgen.,Never have I ever thought I'd die a virgin.,Jo mai he pensat que moriria verge.
195,1,,,Yo nunca he ayudado a un amigo a perder la virginidad.,Never have I ever helped a friend to lose his/her virginity.,Jo mai he ajudat a un amic a perdre la virginitat.
196,2,,,Yo nunca he competido para ligarme a alguien.,Never have I ever competed to hook up with someone,Jo mai he competit per lligar-me a algú.
197,2,,,Yo nunca he ligado por internet.,Never have I ever flirted online,Jo mai he lligat per internet.
198,2,,,Yo nunca he dormido con un desconocido/a.,Never have I ever slept with a stranger.,Jo mai he dormit amb un desconegut/da.
199,2,,,Yo nunca he ligado con alguien con quien no tenia idiomas en común.,Never have I ever flirted with someone who I had no language in common with,Jo mai he lligat amb algú amb qui no tenia idiomes en comú.
200,3,,,Yo nunca he hecho dirty talking durante el sexo.,Never have I ever done dirty talk during sex.,Jo mai he fet dirty talking durant el sexe.
201,5,,,Yo nunca he gemido en un idioma extranjero.,Never have I ever moaned in a foreign language.,Jo mai he gemec en un idioma estranger.
202,3,,,Yo nunca he follado encima de una mesa.,Never have I ever fucked on a table.,Jo mai he follat ​​a sobre d'una taula.
203,3,,,Yo nunca me he follado a un vecino/a.,Never have I ever fucked my neighbor.,Jo mai m'he follat ​​a un veí/ïna.
204,5,,,Yo nunca me he traido a mi pareja a casa de un amigo para follar.,Never have I ever brought my couple to a friend's house to fuck.,Jo mai m'he portat la meva parella a casa d'un amic per follar.
205,3,,,Yo nunca he escuchado a dos amigos hacerlo.,Never have I ever heard two friends doing it,Jo mai he escoltat dos amics fer-ho.
206,5,,,Yo nunca he sido observado mientras tenia sexo.,Never have I ever been observed while having sex.,Jo mai he estat observat mentre tenia sexe.
207,3,,,Yo nunca he follado con mi mascota delante.,Never have I ever fucked with my pet in front,Jo mai he follat ​​amb la meva mascota davant.
208,5,,,Yo nunca he espiado a alguien teniendo sexo.,Never have I ever spied someone having sex.,Jo mai he espiat a algú tenint sexe.
209,5,,,Yo nunca he espiado a alguien en la ducha.,Never have I ever spied someone in the shower.,Jo mai he espiat a algú a la dutxa.
210,3,,,Yo nunca me he masturbado en la ducha.,Never have I ever masturbated in the shower.,Jo mai m'he masturbat a la dutxa.
211,5,,,Yo nunca me he masturbado en un sitio público.,Never have I ever masturbated in a public place.,Jo mai m'he masturbat en un lloc públic.
212,5,,,Yo nunca he masturbado a alguien en un sitio público.,Never have I ever masturbated someone in a public place.,Jo mai he masturbat a algú en un lloc públic.
213,3,,,Yo nunca he tenido sexo en el coche de mis padres.,Never have I ever had sex in my parents' car,Jo mai he tingut sexe al cotxe dels meus pares.
214,3,,,Yo nunca he tenido sexo en la cama de mis padres.,Never have I ever had sex in my parents' bed,Jo mai he tingut sexe al llit dels meus pares.
215,3,,,Yo nunca he tenido que disimular una mancha de corrida.,Never have I ever had to hide a stain of cum,Jo mai he hagut de dissimular una taca de correguda.
216,5,,,Yo nunca me he limpiado la corrida con las sabanas.,Never have I ever cleaned cum with the sheets,Jo mai m'he netejat la correguda amb els llençols.
217,5,,,Yo nunca me he limpiado la corrida con ropa interior.,Never have I ever cleaned cum with underwear.,Jo mai m'he netejat la correguda amb roba interior.
218,3,,,Yo nunca me he dejado ropa interior en casa ajena.,Never have I ever forgotten my underwear in someone else's house.,Jo mai m'he deixat roba interior a casa dels altres.
219,3,,,Yo nunca he dejado ropa en casa ajena para volver.,Never have I ever left clothes in someone else's house to go back there,Jo mai he deixat roba a casa dels altres per tornar.
220,2,,,Yo nunca he usado ropa interior de mis padres.,Never have I ever used my parents' underwear.,Jo mai he fet servir roba interior dels meus pares.
221,2,,,Yo nunca he usado ropa interior del sexo opuesto.,Never have I ever used underwear of the opposite sex.,Jo mai he fet servir roba interior de el sexe oposat.
222,5,,,Yo nunca he mandado callar a alguien durante el sexo.,Never have I ever made someone shut up during sex,Jo mai he manat callar a algú durant el sexe.
223,5,,,Yo nunca he masturbado a alguien con los pies.,Never have I ever done a footjob,Jo mai he masturbat a algú amb els peus.
224,3,,,Yo nunca me he inventado que tenia la regla para no follar.,Never have I ever made up that I had my period to not have sex,Jo mai m'he inventat que tenia la regla per no follar.
225,3,,,Yo nunca me he inventado que me encontraba mal para no follar.,Never have I ever made up that I was not feeling good to not fuck.,Jo mai m'he inventat que em trobava malament per no follar.
226,5,,,Yo nunca he pensado que Ariel de La Sirenita tiene un polvazo.,Never have I ever thought that Ariel from The Little Mermaid is hot,Jo mai he pensat que Ariel de La Sireneta té un polvazo.
227,5,,,Yo nunca he usado hielo durante el sexo.,Never have I ever used ice during sex.,Jo mai he fet servir gel durant el sexe.
228,5,,,Yo nunca he fantaseado con un personaje de un videojuego.,Never have I ever fantasized about a videogame character,Jo mai he fantasejat amb un personatge d'un videojoc.
229,5,,,Yo nunca he recibido un oral mientras jugaba a videojuegos.,Never have I ever received an oral while playing video games.,Jo mai he rebut un oral mentre jugava a videojocs.
230,5,,,Yo nunca me he manchado el pelo de semen.,Never have I ever had semen on my hair,Jo mai m'he tacat els cabells de semen.
231,5,,,Yo nunca he comido corrida.,Never have I ever drunk semen,Jo mai he menjat correguda.
232,1,,,Yo nunca he comido chocolate despues del sexo.,Never have I ever eaten chocolate after sex.,Jo mai he menjat xocolata després de l'sexe.
233,5,,,Yo nunca he jugado con comida durante el sexo.,Never have I ever played with food during sex.,Jo mai he jugat amb menjar durant el sexe.
234,5,,,Yo nunca he utilizado un vibrador.,Never have I ever used a vibrator.,Jo mai he utilitzat un vibrador.
235,3,,,Yo nunca he tenido sexo escuchando reaggeton.,Never have I ever had sex while listening to reaggeton.,Jo mai he tingut sexe escoltant reaggeton.
236,3,,,Yo nunca he tenido que parar durante el sexo por un ataque de risa.,Never have I ever had to stop during sex because of a laughing fit,Jo mai he hagut de parar durant el sexe per un atac de riure.
237,5,,,Yo nunca me he desmayado mientras tenía sexo.,Never have I ever fainted during sex.,Jo mai m'he desmaiat mentre follava.
238,5,,,Yo nunca me he meado mientras follaba.,Never have I ever peed while fucking,Jo mai m'he pixat mentre follava.
239,5,,,Yo nunca he pegado a alguien durante el sexo.,Never have I ever hit my partner during sex.,Jo mai he pegat a algú durant el sexe.
240,5,,,Yo nunca he respondido a una llamada mientras follaba.,Never have I ever responded to a call while fucking,Jo mai he respost a una trucada mentre follava.
241,3,,,Yo nunca he utilizado el ver una pelicula como excusa para acostarme con alguien.,Never have I ever used watching a film as an excuse to get laid.,Jo mai he utilitzat el veure una pelicula com a excusa per anar a dormir amb algú.
242,2,,,Yo nunca he tenido que ver una pelicula dos veces para entenderla.,Never have I ever had to watch a movie twice to understand it.,Jo mai he hagut de veure una pelicula dues vegades per entendre-la.
243,3,,,Yo nunca he tenido que ver una pelicula dos veces por estar follando durante la primera.,Never have I ever had to watch a movie twice because the first time I was fucking so I didn't watch it,Jo mai he tingut a veure una pelicula dues vegades per estar follant durant la primera.
244,5,,,Yo nunca he follado en el cine.,Never have I ever fucked in the cinema,Jo mai he follat ​​al cinema.
245,5,,,Yo nunca he follado con quien sabía que no debía.,Never have I ever fucked someone I shouldn't,Jo mai he follat ​​amb qui sabia que no havia.
246,3,,,Yo nunca me he liado con alguien por lastima.,Never have I ever made out with someone because I felt pity for him/her,Jo mai m'he embolicat amb algú per mal.
247,5,,,Yo nunca me he acostado con alguien por lastima.,Never have I ever slept with someone because I felt pity for him/her,Jo mai m'he ficat al llit amb algú per mal.
248,5,,,Yo nunca he desvirgado a alguien.,Never have I ever deflowered anyone.,Jo mai he desvirgat a algú.
249,5,,,Yo nunca he participado en una orgía.,Never have I ever taken part in an orgy.,Jo mai he participat en una orgia.
250,5,,,Yo nunca he organizado una orgía.,Never have I ever organized an orgy.,Jo mai he organitzat una orgia.
251,3,,,Yo nunca me he quedado con las ganas.,Never have I ever been left craving for it,Jo mai m'he quedat amb les ganes.
252,2,,,Yo nunca he buscado en internet cómo ligar.,Never have I ever searched on the internet how to flirt.,Jo mai he buscat a internet com lligar.
253,3,,,Yo nunca he buscado en internet cómo dar mejores orales.,Never have I ever searched on the internet how to give better orals,Jo mai he buscat a internet com donar millors orals.
254,2,,,Yo nunca he elegido a alguien para hacer un trabajo con la intención de ligar con esa persona.,Never have I ever chosen someone to do a project with the intention of flirting with that person.,Jo mai he escollit a algú per fer un treball amb la intenció de lligar amb aquesta persona.
255,2,,,Yo nunca he flirteado con alguien para conseguir el número de su amigo/a.,Never have I ever flirted with someone to get the number of his/her friend,Jo mai he flirtejat amb algú per aconseguir el número del seu amic o amiga.
256,2,,,Yo nunca me he medido el pene.,Never have I ever measured my penis.,Jo mai m'he mesurat el penis.
257,2,,,Yo nunca me he terminado creyendo una mentira porque no queria aceptar una verdad.,Never have I ever ended up believing a lie because I didn't want to accept the truth,Jo mai m'he acabat creient una mentida perquè no volia acceptar una veritat.
258,1,,,Yo nunca he cantado musica de los 80 en la ducha.,Never have I ever sung music from the 80s in the shower.,Jo mai he cantat música dels 80 a la dutxa.
259,3,,,Yo nunca he durado menos de 5 minutos en la cama.,Never have I ever lasted less than 5 minutes,Jo mai he durat menys de 5 minuts al llit.
260,3,,,Yo nunca he durado más de una hora en la cama.,Never have I ever lasted more than an hour ,Jo mai he durat més d'una hora al llit.
261,2,,,Yo nunca he sido expulsado de un club nocturno.,Never have I ever been thrown out of a nightclub.,Jo mai he estat expulsat d'un club nocturn.
262,5,,,Yo nunca me he liado con dos o más personas aquí presentes.,Never have I ever made out with two or more people present here,Jo mai m'he embolicat amb dues o més persones aquí presents.
263,5,,,Yo nunca me he liado con uno de los presentes.,Never have I ever made out with someone present.,Jo mai m'he embolicat amb un dels presents.
264,5,,,Yo nunca me he acostado con dos de los presentes.,Never have I ever slept with two people present here,Jo mai m'he ficat al llit amb dos dels presents.
265,3,,,Yo nunca he recibido sexo oral sin estar depilado/a.,Never have I ever received oral sex without being shaved.,Jo mai he rebut sexe oral sense estar depilat/ada.
266,2,,,Yo nunca me he tirado un pedo silencioso.,Never have I ever silently farted,Jo mai m'he tirat un pet silenciós.
267,2,,,Yo nunca me he tirado un pedo con regalo.,Never have I ever had a fart with trail,Jo mai m'he tirat un pet amb regal.
268,2,,,Yo nunca he eructado mientras besaba a alguien.,Never have I ever burped while kissing someone.,Jo mai he rotat mentre besava a algú.
269,2,,,Yo nunca he tosido mientras besaba a alguien.,Never have I ever coughed while kissing someone.,Jo mai he tossit mentre besava a algú.
270,5,,,Yo nunca he vomitado mientras besaba a alguien.,Never have I ever vomited while kissing someone.,Jo mai he vomitat mentre besava a algú.
271,2,,,Yo nunca he pensado que soy asexual.,Never have I ever thought that I might be asexual,Jo mai he pensat que sóc asexual.
272,2,,,Yo nunca he dudado de la orientación sexual de alguno de los presentes.,Never have I ever doubted the sexual orientation of anyone present.,Jo mai he dubtat de l'orientació sexual d'algun dels presents.
273,3,,,Yo nunca besaría al jugador/a de mi izquierda.,Never have I ever wanted to kiss the player on my left,Jo mai faria un petó a el jugador / a de la meva esquerra.
274,3,,,Yo nunca besaría al jugador/a de mi derecha.,Never have I ever wanted to kiss the player on my right,Jo mai faria un petó a el jugador / a de la meva dreta.
275,3,,,Yo nunca he hecho una mamada.,Never have I ever given a blowjob.,Jo mai he fet una mamada.
276,3,,,Yo nunca he pensado que el tamaño importa.,Never have I ever thought that size matters.,Jo mai he pensat que la mida importa.
277,2,,,Yo nunca he sido okupa.,Never have I ever been living illegally in a stranger's house,Jo mai he estat okupa.
278,5,,,Yo nunca he agradecido que la tuviese tan grande.,Never have I ever enjoyed him having it that big,Jo mai he agraït que la tingués tan gran.
279,5,,,Yo nunca he dudado sobre si ya estaba dentro.,Never have I ever doubted if it was already inside of me,Jo mai he dubtat sobre si ja era a dins o no.
280,2,,,Yo nunca me he vomitado encima.,Never have I ever vomited over myself,Jo mai m'he vomitat a sobre.
281,4,,,Yo nunca me he emborrachado con mis padres.,Never have I ever gotten drunk with my parents.,Jo mai m'he emborratxat amb els meus pares.
282,4,,,Yo nunca he fumado con mis padres.,Never have I ever smoked with my parents.,Jo mai he fumat amb els meus pares.
283,5,,,Yo nunca he hecho intercambio de parejas.,Never have I ever done mate-swapping,Jo mai he fet intercanvi de parelles.
284,3,,,Yo nunca he recibido cachetadas mientras tenia sexo.,Never have I ever been slapped during sex,Jo mai he rebut cachetadas mentre tenia sexe.
285,3,,,Yo nunca he pedido que me den cachetadas durante el sexo.,Never have I ever asked for slaps during sex.,Jo mai he demanat que em donin cachetadas durant el sexe.
286,3,,,Yo nunca me he aburrido teniendo sexo.,Never have I ever been bored while having sex,Jo mai m'he avorrit tenint sexe.
287,2,,,Yo nunca he tenido una cita a ciegas.,Never have I ever had a blind date.,Jo mai he tingut una cita a cegues.
288,3,,,Yo nunca he dejado de tener sexo antes de correrme.,Never have I ever stopped having sex before cumming.,Jo mai he deixat de tenir sexe abans de escórrer.
289,3,,,Yo nunca he hecho la marcha atrás.,Never have I ever pulled out to cum,Jo mai he fet la marxa enrere.
290,5,,,Yo nunca he rechazado un trio.,Never have I ever turned down a threesome,Jo mai he rebutjat un trio.
291,4,,,Yo nunca he sido pillado por mis padres fumando.,Never have I ever been caught by my parents smoking.,Jo mai he estat enxampat pels meus pares fumant.
292,5,,,Yo nunca me he hecho una prueba de embarazo.,Never have I ever done a pregnancy test.,Jo mai m'he fet una prova d'embaràs.
293,2,,,Yo nunca he pensado que alguien besa fatal.,Never have I ever thought someone was a terrible kisser,Jo mai he pensat que algú fa un petó fatal.
294,2,,,Yo nunca he mandado fotos de mi mierda.,Never have I ever sent pictures of a shit I had just taken.,Jo mai he manat fotos de la meva merda.
295,3,uwu,,Yo nunca he pensado que la persona que mejor me ha besado está entre los presentes.,Never have I ever thought the best kisser I have ever meet is here right now,Jo mai he pensat que la persona que millor m'ha besat està entre els presents.
296,5,,,Yo nunca he tenido una relación abierta.,Never have I ever had an open relationship.,Jo mai he tingut una relació oberta.
297,5,,,Yo nunca me he arrepentido de tener una relación abierta.,Never have I ever regretted having an open relationship.,Jo mai m'he penedit de tenir una relació oberta.
298,3,,,Yo nunca me he acostado con alguien en la primera cita.,Never have I ever slept with someone on the first date.,Jo mai m'he ficat al llit amb algú a la primera cita.
299,3,,,Yo nunca he tenido conversaciones eróticas por teléfono.,Never have I ever had erotic telephone conversations.,Jo mai he tingut converses eròtiques per telèfon.
300,2,,,Yo nunca he salido a la calle sin ropa interior.,Never have I ever gone out without underwear.,Jo mai he sortit al carrer sense roba interior.
301,2,,,Yo nunca he ido por la calle en ropa interior.,Never have I ever gone out in underwear,Jo mai he anat pel carrer en roba interior.
302,3,,,Yo nunca me he masturbado 4 veces el mismo día.,Never have I ever masturbated 4 times the same day.,Jo mai m'he masturbat 4 vegades el mateix dia.
303,3,,,Yo nunca he practicado sexo en una terraza.,Never have I ever had sex on a terrace.,Jo mai he practicat sexe en una terrassa.
304,3,,,Yo nunca he perdido la virginidad en un sitio que no sea una cama.,Never have I ever lost my virginity in a place other than a bed.,Jo mai he perdut la virginitat en un lloc que no sigui un llit.
305,5,,,Yo nunca me he equivocado de nombre durante el sexo.,Never have I ever said the wrong name during sex.,Jo mai m'he equivocat de nom durant el sexe.
306,5,uwu,,"Yo nunca he tenido ganas de hacer ""cosas"" con alguien aqui presente.","Never have I ever felt like doing ""things"" with anyone here.","Jo mai he tingut ganes de fer ""coses"" amb algú aqui present."
307,5,,,Yo nunca he experimentado con mi orientación sexual.,Never have I ever experienced with my sexual orientation.,Jo mai he experimentat amb la meva orientació sexual.
308,2,,,Yo nunca he hecho un sinpa.,Never have I ever run away without paying,Jo mai he fet un sinpa.
309,5,,,Yo nunca he sido infiel.,Never have I ever been unfaithful.,Jo mai he estat infidel.
310,2,,,Yo nunca he sido un/a cornudo/a.,Never have I ever been a cuckold.,Jo mai he estat un/a banyut/uda.
311,3,,,Yo nunca he pensado en probar el semen.,Never have I ever thought about tasting semen.,Jo mai he pensat en provar el semen.
312,2,,,Yo nunca he borrado el historial del navegador para esconder algo.,Never have I ever erased my browser's history to hide something,Jo mai he esborrat l'historial de el navegador per amagar alguna cosa.
313,2,,,Yo nunca he tenido celos de alguno de los presentes.,Never have I ever been jealous of anyone present.,Jo mai he tingut gelosia d'algun dels presents.
314,1,,,Yo nunca me he tirado un pedo en la piscina.,Never have I ever farted in the pool.,Jo mai m'he tirat un pet a la piscina.
315,3,,,Yo nunca he tenido sexo ilegal.,Never have I ever had illegal sex.,Jo mai he tingut sexe il·legal.
316,3,,,Yo nunca he tenido semen en la cara.,Never have I ever received a facial,Jo mai he tingut semen a la cara.
317,5,,,Yo nunca me he masturbado en grupo.,Never have I ever masturbated in group.,Jo mai m'he masturbat en grup.
318,2,,,Yo nunca he bailado desnudo/a.,Never have I ever danced naked.,Jo mai he ballat nu/a.
319,3,,,Yo nunca he atado a mi pareja durante el sexo.,Never have I ever tied my partner during sex.,Jo mai he lligat a la meva parella durant el sexe.
320,3,,,Yo nunca he sido atado/a durante el sexo.,Never have I ever been tied during sex.,Jo mai he estat lligat/ada durant el sexe.
321,5,,,Yo nunca me he excitado pensando en alguno de los presentes.,Never have I ever gotten horny thinking of someone present here,Jo mai m'he excitat pensant en algun dels presents.
322,2,,,Yo nunca me he empalmado en la playa.,Never have I ever gotten hard in the beach.,Jo mai m'he empalmat a la platja.
323,5,El Cid,,Yo nunca he mojado la espada de sangre.,Never have I ever gotten my sword wet in blood,Jo mai he mullat l'espasa de sang.
324,3,,,Yo nunca me he masturbado en el coche.,Never have I ever masturbated in the car.,Jo mai m'he masturbat al cotxe.
325,2,,,Yo nunca me he liado con alguien que tenia pareja.,Never have I ever hooked up with someone who had a boyfriend / girlfriend,Jo mai m'he embolicat amb algú que tenia parella.
326,2,,,Yo nunca he mentido sobre si era virgen.,Never have I ever lied about being a virgin.,Jo mai he mentit sobre si era verge.
327,5,,,Yo nunca he recibido una sexo oral mientras conducía.,Never have I ever received oral sex while driving.,Jo mai he rebut una sexe oral mentre conduïa.
328,5,,,Yo nunca he recibido una paja/dedos mientras conducía.,Never have I ever been masturbated while driving.,Jo mai he rebut una palla/dits mentre conduïa.
329,2,,,Yo nunca he mordido el culo a alguien.,Never have I ever bitten anyone's ass.,Jo mai he mossegat el cul a algú.
330,3,,,Yo nunca he hecho un 69.,Never have I ever done a 69.,Jo mai he fet un 69.
331,3,Tu me la comes y yo te debo una,,Yo nunca he hecho un 68.,Never have I ever done a 68,Jo mai he fet un 68
332,3,,,Yo nunca lo he hecho en la ducha.,Never have I ever done it in the shower.,Jo mai ho he fet a la dutxa.
333,3,,,Yo nunca lo he hecho en la postura de misionero.,Never have I ever done it missionary style,Jo mai ho he fet en la postura de missioner.
334,3,,,Yo nunca lo he hecho en la postura del perrito.,Never have I ever done it doggy style,Jo mai ho he fet en la postura de l'gosset.
335,3,,,Yo nunca lo he hecho en la postura de cowgirl.,Never have I ever done it cowgirl style,Jo mai ho he fet en la postura de cowgirl.
336,3,,,"Yo nunca lo he hecho en la postura de ""la sillita de la reina"".","Never have I ever done it in the position of ""the queen's seat""","Jo mai ho he fet en la postura de ""la cadireta de la reina""."
337,3,,,Yo nunca he intentado seguir el Kamasutra.,Never have I ever tried to follow the Kamasutra.,Jo mai he intentat seguir el Kamasutra.
338,5,,,Yo nunca he practicado sexo en el baño de una discoteca.,Never have I ever had sex in the toilet of a nightclub.,Jo mai he practicat sexe al bany d'una discoteca.
