Id,Naughtiness,Author,SpecialOptions,es-es,en-us,ca
339,5,,,Yo nunca me he liado con quién esta leyendo.,Never have I ever hooked up with who is currently reading this,Jo mai m'he embolicat amb qui aquesta llegint.
340,3,,,Yo nunca me he saltado clases para tener sexo.,Never have I ever skipped classes to have sex.,Jo mai m'he saltat classes per tenir sexe.
341,5,,,Yo nunca me he liado con la ex-pareja de alguno de los presentes.,Never have I ever hooked up with the ex-partner of anyone present.,Jo mai m'he embolicat amb l'ex-parella d'algun dels presents.
342,2,,,Yo nunca le he mirado el culo a alguno de los presentes.,Never have I ever looked at someone present's ass,Jo mai li he mirat el cul a algun dels presents.
343,2,,,Yo nunca he besado a alguien con un chicle en la boca.,Never have I ever kissed anyone with gum in my mouth.,Jo mai he besat a algú amb un xiclet a la boca.
344,3,,,Yo nunca he intentado recibir o hacer una cubana y no he podido.,Never have I ever tried to receive or make a titjob and I have not been able to.,Jo mai he intentat rebre o fer una cubana i no he pogut.
345,3,,,Yo nunca he recibido o hecho una cubana.,Never have I ever received or done a titjob.,Jo mai he rebut o fet una cubana.
346,3,,,Yo nunca he follado mientras miraba una pelicula porno.,Never have I ever fucked while watching a porn movie.,Jo mai he follat ​​mentre mirava una pelicula porno.
347,2,,,Yo nunca me he masturbado en las últimas 24h.,Never have I ever masturbated in the last 24 hours.,Jo mai m'he masturbat en les últimes 24 hores.
348,2,,,Yo nunca me he masturbado en casa de un amigo/a.,Never have I ever masturbated at a friend's house,Jo mai m'he masturbat a casa d'un amic o amiga.
349,3,,,Yo nunca me he masturbado con alguien al lado.,Never have I ever masturbated with someone next to me,Jo mai m'he masturbat amb algú a la banda.
350,2,,,Yo nunca he enseñado las tetas en un festival.,Never have I ever showed my boobs in a festival,Jo mai he ensenyat els pits en un festival.
351,1,,,Yo nunca me he liado con alguien que se llame igual que yo.,Never have I ever hooked up with someone named like me,Jo mai m'he embolicat amb algú que es digui igual que jo.
352,5,,,Yo nunca he pensado que alguno de los presentes necesita un polvo YA.,Never have I ever thought that someone present needs to fuck urgently,Jo mai he pensat que algun dels presents necessita un quiqui JA.
353,2,,,Yo nunca he meado en la calle.,Never have I ever peed in the street.,Jo mai he pixat al carrer.
354,3,Giss,,Yo nunca me he acostado con alguien que tuviera hijos.,Never have I ever had sex with someone who had children.,Jo mai he follat amb algú que tingués fills.
355,2,,,Yo nunca he probado hasta dónde podía tragarme algo.,Never have I ever tried how deep could i have something in my mouth,Jo mai he provat fins on podia empassar-me alguna cosa.
356,2,,,Yo nunca le he conseguido un ligue a un amigo/a.,Never have I ever gotten a friend a date.,Jo mai li he aconseguit una cita a un amic o amiga.
357,2,,,"Yo nunca he pagado un hotel para follar, pero la noche salió mal.","Never have I ever paid for a hotel to fuck, but the night ended up badly","Jo mai he pagat un hotel per follar, però la nit va sortir malament."
358,5,,,Yo nunca me he ido de viaje con mi ex.,Never have I ever gone on a trip with my ex.,Jo mai m'he anat de viatge amb el meu ex.
359,2,,,Yo nunca he recibido quejas de mis vecinos durante mis fiestas.,Never have I ever received complaints from my neighbors during my parties,Jo mai he rebut queixes dels meus veïns durant els meus festes.
360,3,,,Yo nunca he gemido a pesar de saber que me estaban escuchando.,Never have I ever moaned despite knowing I was being heard,Jo mai he gemec tot i saber que m'estaven escoltant.
361,2,,,Yo nunca he sido rechazado/a por dos o más personas en una noche.,Never have I ever been rejected by two or more people the same night,Jo mai he estat rebutjat/ada per dues o més persones en una nit.
362,3,,,Yo nunca he tenido sexo en la cocina.,Never have I ever had sex in the kitchen.,Jo mai he tingut sexe a la cuina.
363,5,,,Yo nunca le he zorreado a alguien para conseguir algo.,Never have I ever twerked on someone to get something from them,Jo mai li he zorreado a algú per aconseguir alguna cosa.
364,5,,,Yo nunca me he despertado al lado de un/a desconocido/a.,Never have I ever woken up next to a stranger.,Jo mai m'he despertat al costat d'un/a desconegut/uda.
365,2,,,Yo nunca he recibido una cobra.,Never have I ever received a cobra.,Jo mai he rebut una cobra.
366,2,,,Yo nunca he hecho la cobra.,Never have I ever done the cobra.,Jo mai he fet la cobra.
367,2,,,Yo nunca he dudado sobre si me he liado con alguien.,Never have I ever doubted whether I've made out with someone specific or not,Jo mai he dubtat sobre si m'he embolicat amb algú.
368,5,,,Yo nunca he dudado sobre si lo he hecho con alguien.,Never have I ever doubted whether I've done it with someone specific or not,Jo mai he dubtat sobre si ho he fet amb algú.
369,3,,,Yo nunca he estado más de un año sin tener sexo después de perder la virginidad.,Never have I ever been more than a year without having sex after having lost my virginity.,Jo mai he estat més d'un any sense tenir sexe després de perdre la virginitat.
370,2,,,Yo nunca me he vestido excesivamente sexy para una entrevista de trabajo.,Never have I ever dressed too sexy for a job interview.,Jo mai m'he vestit excessivament sexy per a una entrevista de treball.
371,4,,,Yo nunca me he emborrachado en una boda para ligar.,Never have I ever gotten drunk at a wedding to flirt.,Jo mai m'he emborratxat en un casament per lligar.
372,2,,,Yo nunca he comparado el tamaño de mi pene con algun amigo.,Never have I ever compared the size of my penis with a friend.,Jo mai he comparat la mida del meu penis amb el d'algun amic.
373,2,,,Yo nunca he comparado el tamaño de mis pechos con alguna amiga.,Never have I ever compared the size of my breasts with a friend.,Jo mai he comparat la mida dels meus pits amb els d'alguna amiga.
374,2,,,Yo nunca he usado un tampax durante mas de 12h.,Never have I ever used a tampon for more than 12h.,Jo mai he fet servir un tampax durant més de 12h.
375,1,,,Yo nunca me he sentido atraido/a por la pareja de un amigo/a.,Never have I ever felt attracted to a friend's partner,Jo mai m'he sentit atret/a per la parella d'un amic o amiga.
376,2,,,Yo nunca he usado una compresa durante mas de un dia.,Never have I ever used a sanity pad for more than one day.,Jo mai he fet servir una compresa durant més d'un dia.
377,1,Una paja y a dormir,,Yo nunca me he hecho un Vladimir.,Never have I ever done a Vladimir.,Jo mai m'he fet un Vladimir.
378,5,,,Yo nunca me he masturbado con una fruta u hortaliza.,Never have I ever masturbated with a fruit or vegetable.,Jo mai m'he masturbat amb una fruita o hortalissa.
379,5,,,Yo nunca he tenido más de un folla-amigo/a a la vez.,Never have I ever had more than one fuck-friend at a time.,Jo mai he tingut més d'un folla-amic o folla-amiga a la vegada.
380,2,,,Yo nunca he hecho un chupetón.,Never have I ever done a hickey.,Jo mai he fet una xuclada.
381,1,,,Yo nunca he recibido un chupetón.,Never have I ever received a hickey.,Jo mai he rebut una xuclada.
382,2,,,Yo nunca he intentado ligar con alguien que no conocía por la calle.,Never have I ever tried to flirt with someone who I didn't know in the middle of the street,Jo mai he intentat lligar amb algú que no coneixia pel carrer.
383,5,,,Yo nunca he sido grabado/a mientras practicaba sexo.,Never have I ever been recorded during sex.,Jo mai he estat gravat/ada durant el sexe.
384,2,,,Yo nunca he visto porno en compañía.,Never have I ever seen porn in company.,Jo mai he vist porno en companyia.
385,4,,,Yo nunca he ido a clase fumado/a.,Never have I ever gone to class while being high.,Jo mai he anat a classe fumat/ada.
386,2,,,Yo nunca he ido a clase con resaca.,Never have I ever gone to a class with a hangover.,Jo mai he anat a classe amb resaca.
387,4,,,Yo nunca me he emborrachado en clase.,Never have I ever gotten drunk in a class.,Jo mai m'he emborratxat a classe.
388,2,,,Yo nunca he pensado que mis tetas son perfectas.,Never have I ever thought that my boobs are perfect.,Jo mai he pensat que els meus pits són perfectes.
389,1,,,Yo nunca he hecho topless.,Never have I ever done topless.,Jo mai he fet topless.
390,3,,,Yo nunca he practicado sexo delante de un espejo.,Never have I ever had sex in front of a mirror.,Jo mai he practicat sexe davant d'un mirall.
391,3,,,Yo nunca he tenido sexo en un barco.,Never have I ever had sex on a boat.,Jo mai he tingut sexe en un vaixell.
392,2,Harambe,,Yo nunca me he masturbado en un avión.,Never have I ever masturbated in an airplane.,Jo mai m'he masturbat en un avió.
393,4,,,Yo nunca he probado las setas.,Never have I ever done mushrooms.,Jo mai he provat de consumir bolets al·lucinògens.
394,3,,,Yo nunca he tenido sexo en el suelo.,Never have I ever had sex on the floor.,Jo mai he tingut sexe a terra.
395,3,,,Yo nunca he follado en la piscina.,Never have I ever fucked in the pool.,Jo mai he follat ​​a la piscina.
396,3,,,Yo nunca he follado en el cuarto de mi hermano/a.,Never have I ever fucked in my brother's / sister's room.,Jo mai he follat ​​a la cambra del meu germà/ana.
397,1,,,A mi nunca se me ha caído el móvil en el retrete.,Never have I ever accidentally dropped the phone in the toilet.,A mi mai se m'ha caigut el mòbil al lavabo.
398,2,,,Yo nunca he guardado un video porno en favoritos.,"Never have I ever saved a porn video in my ""favorites""",Jo mai he guardat un vídeo porno en favorits.
399,4,420,,Yo nunca he celebrado el 20 de Abril.,Never have I ever celebrated the 20th of April.,Jo mai he celebrat el 20 d'abril.
400,2,,,Yo nunca he sido rechazado/a en público.,Never have I ever been rejected in public.,Jo mai he estat rebutjat/ada en públic.
401,5,Poy,,Yo nunca he pagado por el premium de una página porno.,Never have I ever paid for premium in a porn site.> A> Poy <a <,Jo mai he pagat pel premium d'una pàgina porno.> A> Poy <a <
402,5,,,Yo nunca he pagado por porno.,Never have I ever paid for porn.,Jo mai he pagat per porno.
403,2,Paquito,,Yo nunca he celebrado el 20 de noviembre.,Never have I ever celebrated the 20th of November.,Jo mai he celebrat el 20 de novembre.
404,2,Buri,,Yo nunca me he llevado algo de casa de alguien para tener una excusa para volver.,Never have I ever taken something from someone's home to have an excuse to go back there.,Jo mai m'he endut alguna cosa de casa d'algú per a tenir una excusa per a tornar.
405,3,Buri,,Yo nunca me he comido una polla con condón.,Never have I ever sucked a dick with a condom on it.> A> Buri <a <,Jo mai m'he menjat una polla amb condó.> A> Buri <a <
406,4,,,Yo nunca he terminado en el hospital tras salir de fiesta.,Never have I ever ended up in a hospital after partying.,Jo mai he acabat a l'hospital després de sortir de festa.
407,1,Buri,,Yo nunca he llevado calcetines diferentes en cada pié.,Never have I ever worn unmatching socks.> A> Buri <a <,Jo mai he portat mitjons diferents en cada peu.> A> Buri <a <
408,3,,,Yo nunca he hecho un striptease.,Never have I ever done a striptease.,Jo mai he fet un streaptease.
409,5,,,Yo nunca he comido corrida de encima de unas tetas.,Never have I ever sucked someone's tits after they had been cummed on,Jo mai he menjat correguda de sobre d'unes mamelles.
410,5,,,Yo nunca me he liado con corrida en la boca.,Never have I ever made out with cum in my mouth,Jo mai m'he embolicat amb correguda a la boca.
411,5,,,Yo nunca me he comido mi propia corrida.,Never have I ever tasted my own semen,Jo mai m'he menjat la meva pròpia correguda.
412,1,,,Yo nunca he buscado porno en YouTube.,Never have I ever looked for porn on YouTube.,Jo mai he buscat porno a YouTube.
413,4,,,Yo nunca he dicho que probaría las setas y no lo he hecho.,Never have I ever said I would try mushrooms and haven't done it,Jo mai he dit que provaria els bolets i no ho he fet.
414,5,,,Yo nunca la he sacado manchada tras hacer un anal.,Never have I ever pulled it out dirty after anal sex,Jo mai l'he tret tacada després de fer un anal.
415,5,,,Yo nunca he hecho un anal.,Never have I ever given anal sex,Jo mai he fet un anal.
416,5,,,Yo nunca he recibido sexo anal.,Never have I ever received anal sex,Jo mai he rebut sexe anal.
417,4,Bieloman,,Yo nunca he pillado dos blancazos en una noche.,Never have I ever passed out twice the same night.> A> Bieloman <a <,Jo mai he enxampat 2 blancazos en una nit.> A> Bieloman <a <
418,5,Núria,,Yo nunca me he masturbado teniendo una conversación por chat.,Never have I ever masturbated while chatting.> A> Núria <a <,Jo mai m'he masturbat tenint una conversa per xat.> A> Núria <a <
419,5,,,Yo nunca he tenido sexo con alguien que tenía pareja.,Never have I ever had sex with someone who had a partner.,Jo mai he tingut sexe amb algú que tenia parella.
420,2,,,Yo nunca he dado plantón en una cita.,Never have I ever stood someone up,Jo mai he plantat en una cita.
421,2,,,Yo nunca he pedido a alguien que me llamara para irme de una cita que no estaba disfrutando.,Never have I ever asked someone to call to have an excuse to leave from a bad date,Jo mai he demanat a algú que em truqués per anar-me'n d'una cita que no estava gaudint.
422,5,,,Yo nunca me he comido más de una polla a la vez.,Never have I ever eaten more than one cock at a time.,Jo mai m'he menjat més d'una polla alhora.
423,5,,,Yo nunca me he comido más de una polla la misma noche.,Never have I ever eaten more than one cock the same night,Jo mai m'he menjat més d'una polla la mateixa nit.
424,5,,,Yo nunca me he comido más de un coño la misma noche.,Never have I ever eaten more than a pussy the same night,Jo mai m'he menjat més d'un cony la mateixa nit.
425,5,,,Yo nunca he pensado que alguien de los presentes besa fatal.,Never have I ever thought that someone present is a terrible kisser,Jo mai he pensat que algú dels presents besa fatal.
426,5,,,Yo nunca me he masturbado en el coche con más gente en él.,Never have I ever masturbated in a car with other people in it,Jo mai m'he masturbat al cotxe amb més gent en ell.
427,4,,,Yo nunca he comido algo con marihuana.,Never have I ever eaten anything containing marijuana.,Jo mai he menjat alguna cosa amb marihuana.
428,4,,,Yo nunca he fumado marihuana.,Never have I ever smoked marijuana.,Jo mai he fumat marihuana.
429,2,,,Yo nunca he dejado que unos condones me caduquen.,Never have I ever let any of my condoms expire,Jo mai he deixat que uns condons em caduquin.
430,5,,,Yo nunca he usado un condón caducado.,Never have I ever used an expired condom.,Jo mai he fet servir un condó caducat.
431,2,,,Yo nunca me he liado con alguien después de vomitar.,Never have I ever made out after vomiting.,Jo mai m'he embolicat amb algú després de vomitar.
432,2,,,Yo nunca me he liado con alguien después de que la otra persona vomitara.,Never have I ever made out with someone after the other person vomit.,Jo mai m'he embolicat amb algú després que l'altra persona vomités.
433,1,,,Yo nunca he vomitado delante de la persona que me gustaba.,Never have I ever vomited in front of the person I liked.,Jo mai he vomitat davant de la persona que m'agradava.
434,2,,,Yo nunca he robado un bolo (bowling),Never have I ever stolen a bowling pin,Jo mai he robat una bitlla
435,2,,,Yo nunca he elegido un libro por su escaso número de páginas.,Never have I ever chosen a book for its poor number of pages.,Jo mai he triat un llibre pel seu escàs nombre de pàgines.
436,1,,,Yo nunca he escuchado una canción de K-pop.,Never have I ever heard a K-pop song,Jo mai he escoltat una cançó de K-pop.
437,1,Obroni,,Yo nunca he viajado a Africa,Never have I ever traveled to Africa,Jo mai he viatjat a Àfrica
438,1,Ahora es un buen momento,,Yo nunca he valorado con 5 estrellas una App.,Never have I ever rated an app with 5 stars> A> Now is a good time <a <,Jo mai he valorat amb 5 estrelles una App.> A> Ara és un bon moment <a <
439,2,,,Yo nunca he pensado en como follan los erizos.,Never have I ever thought about how hedgehogs fuck.,Jo mai he pensat en com follen els eriçons.
440,2,,,Yo nunca he dibujado un pene en un coche sucio.,Never have I ever drawn a penis in a dirty car.,Jo mai he dibuixat un penis en un cotxe brut.
441,2,,,Yo nunca he dejado mierda de mi perro en la calle.,Never have I ever left my dog's ​​shit on the street.,Jo mai he deixat merda del meu gos al carrer.
442,5,,,Yo nunca he deseado ver a dos de los presentes follando.,Never have I ever wanted to see two people present here having sex,Jo mai he desitjat veure a dos dels presents follant.
443,5,,,Yo nunca he disfrutado de ver a alguien follar en persona (sin que me implicara en el sexo).,Never have I ever enjoyed seeing live how other people have sex,Jo mai he gaudit de veure algú follar en persona (sense que em impliqués en el sexe).
444,1,,,Yo nunca he ido al baño en el momento de pagar para que me invitaran a algo.,Never have I ever gone to the bathroom when we had to pay so that someone else pays for me,Jo mai he anat a el bany en el moment de pagar perquè em convidessin a alguna cosa.
445,2,Núria,,Yo nunca he tenido problemas para desabrochar un sujetador.,Never have I ever had trouble unfastening a bra.> A> Núria <a <,Jo mai he tingut problemes per a treure-li a algú el sostenidor.
446,1,,,Yo nunca he roto ropa de tanto usarla.,Never have I ever broken clothes by using them for too long,Jo mai he trencat roba de tant usar-la.
447,5,,,Yo nunca he metido mano o me han metido mano en un taxi.,Never have I ever gropped or been gropped in a taxi,Jo mai he ficat mà o m'han ficat mà en un taxi.
448,5,,,Yo nunca me he tocado con fotos o vídeos de una ex-pareja.,Never have I ever touched myself looking at photos or videos of an ex-partner.,Jo mai m'he tocat amb fotos o vídeos d'una ex-parella.
449,5,,,Yo nunca me he tocado con fotos o vídeos que me habían pedido que borrara.,Never have I ever masturbated with photos or videos that I had been asked to delete,Jo mai m'he tocat amb fotos o vídeos que m'havien demanat que esborrés.
450,4,,,Yo nunca me he bebido un litro de cerveza de golpe.,Never have I ever drunk a liter of beer at once.,Jo mai m'he begut un litre de cervesa de cop.
451,5,Zoso,,Yo nunca he usado un succionador de clitoris.,Never have I ever used a clit suction toy.> A> Zoso <a <,Jo mai he fet servir un succionador de clitoris.> A> Zoso <a <
452,2,,,Yo nunca he hecho autoestop para volver de fiesta.,Never have I ever hitchhiked to get back from a party,Jo mai he fet autoestop per tornar de festa.
453,5,,,Yo nunca he echado de menos el sexo de un/a ex,Never have I ever missed sex with my ex,Jo mai he trobat a faltar el sexe d'una exparella.
454,5,Bomberos,,Yo nunca le he aguantado la manguera a alguien mientras meaba.,Never have I ever held someone's hose while they peed.> A> The firefighter <a <,Jo mai li he aguantat la mànega a algú mentre pixava.> A> Bombers <a <
455,5,,,Yo nunca he sido masturbado en el coche con más gente en él.,Never have I ever been masturbated in a car with other people in it.,Jo mai he estat masturbat al cotxe amb més gent en ell.
456,4,,,Yo nunca he bebido un chupito en llamas.,Never have I ever drunk a shot in flames.,Jo mai he begut un xarrup en flames.
457,2,,,Yo nunca he roto un contrato de confidencialidad.,Never have I ever broken a confidentiality agreement.,Jo mai he trencat un contracte de confidencialitat.
458,2,,,Yo nunca he vendido información confidencial.,Never have I ever sold confidential information.,Jo mai he venut informació confidencial.
459,5,Buri,,Yo nunca me he comido una polla con un condón de sabores.,Never have I ever sucked a dick with a flavored condom.> A> Buri <a <,Jo mai m'he menjat una polla amb un condó de sabors.> A> Buri <a <
460,4,,,Yo nunca he comprado más de 100g de hierba de golpe.,Never have I ever bought more than 100g of weed in one purchase,Jo mai he comprat més de 100g d'herba de cop.
461,1,,,Yo nunca he pedido una canción al DJ.,Never have I ever asked for a song to the DJ.,Jo mai he demanat una cançó a l'DJ.
462,1,Buri,,Yo nunca he jugado a juegos de rol.,Never have I ever played rol games.> A> Buri <a <,Jo mai he jugat a jocs de rol.> A> Buri <a <
463,2,Buri,,Yo nunca me he meado de la risa.,Never have I ever peed because I laughed too much.> A> Buri <a <,Jo mai m'he pixat del riure.> A> Buri <a <
464,2,Buri,,Yo nunca he rallado un coche ajeno,Never have I ever scratched someone else's car,Jo mai he ratllat un cotxe aliè
465,2,,,Yo nunca me he meado conduciendo.,Never have I ever peed while driving.,Jo mai m'he pixat conduint.
466,2,,,Yo nunca he meado en el lateral de una carretera.,Never have I ever peed on the side of a road.,Jo mai he pixat al lateral d'una carretera.
467,3,judit esquerdats,,A mi nunca me lo han comido después de que hayan comido picante.,Never have I ever received an oral after that person ate spicy food.> A>Judit Esquerdats<a <,A mi mai me l'han menjat després que hagin menjat picant.> A> judit esquerdats <a <
468,1,,,Yo nunca he tenido problemas al cagar tras comer demasiado picante.,Never have I ever had trouble taking a shit after eating spicy food,Jo mai he tingut problemes a l'cagar després de menjar massa picant.
469,3,Núria,,Yo nunca he recordado una polla distinta a lo que realmente era.,Never have I ever thought a dick was different than what I remembered.> A> Núria <a <,Jo mai he recordat una polla diferent al que realment era.> A> Núria <a <
470,3,Núria,,Yo nunca me he olvidado de las partes de alguien quien me he tirado,Never have I ever forgotten how the intimate parts of someone I've fucked looked like,Jo mai m'he oblidat de les parts d'algú qui m'he tirat
471,3,Núria,,Yo nunca he tomado anticonceptivos para evitar la regla,Never have I ever taken contraceptive pills to avoid my period,Jo mai he pres anticonceptius per evitar la regla
472,5,,,Yo nunca me he masturbado mirando fotos del insta de alguien que conozco.,Never have I ever masturbated looking at Instagram pics of someone I know,Jo mai m'he masturbat mirant fotos de l'insta d'algú que conec.
473,5,,,A mí nunca me ha venido a buscar mi pareja en casa de la persona con la que le había puesto los cuernos.,Never have I ever been picked up by my partner at the house of with who I had cheated on him/her,A mi mai m'ha vingut a buscar la meva parella a casa de la persona amb la qual li havia posat les banyes.> A> Buri <a <
474,2,Buri,,Yo nunca he cagado dentro del agua.,Never have I ever pooped inside the water.> A> Buri <a <,Jo mai he cagat dins l'aigua.> A> Buri <a <
475,2,Buri,,Yo nunca he hecho putadas a alguien que estaba durmiendo,Never have I ever played a prank on someone who was sleeping,Jo mai he fet putades a algú que estava dormint
476,2,Buri,,A mi nunca me han hecho putadas mientras dormía,Never have I ever been pranked while I was sleeping.,A mi mai m'han fet putades mentre dormia
477,1,,,Yo nunca he hecho snow.,Never have I ever practiced snowboarding.,Jo mai he fet snow.
478,1,,,Yo nunca he esquiado.,Never have I ever skied.,Jo mai he esquiat.
479,5,Venteo,,Yo nunca he follado en una grúa.,Never have I ever fucked on a crane.,Jo mai he follat ​​en una grua.
480,2,Venteo,,Yo nunca he subido a una grúa.,Never have I ever climbed a crane.,Jo mai he pujat a una grua.
481,4,,,Yo nunca me he fumado un peta con mi jefe/a.,Never have I ever smoked a joint with my boss.,Jo mai m'he fumat un peta amb el meu jefe/a.
482,5,El Sando,,Yo nunca he tenido éxito mandando una fotopolla.,Never have I ever been successful sending a dick pic.,Jo mai he tingut èxit enviant una 'fotopolla'.
483,2,Núria,,"Yo nunca he dicho ""gracias"" cuando alguien me ha dicho ""te quiero"".","Never have I ever said ""thank you"" when someone has said ""I love you"" to me.","Jo mai he dit ""gràcies"" quan algú m'ha dit ""t'estimo""."
484,5,klk,,Yo nunca he follado en el coche con más gente dentro.,Never have I ever had sex in a car with more people in it.,Jo mai he follat en un cotxe amb més gent a dins.
485,5,klk,,Yo nunca he hecho sexo oral más de una vez en una misma noche.,Never have I ever did a more than one cunnilingus in one night.,Jo mai m'he menjat més d'un cony la mateixa nit.
486,5,klk,,Yo nunca he hecho un trio con dos amigas.,Never have I ever had a thresome with two female friends.,Jo mai he fet un trio amb dues amigues.
487,5,klk,,Yo nunca he follado en una piscina pública/comunitaria de día.,Never have I ever had sex in a public pool at daytime.,Jo mai he follat en una picina pública durant el dia.
488,3,klk,,Yo nunca he tenido semen en el ojo.,Never have I ever had semen in the eye.,Jo mai he tingut semen a l'ull.
489,3,Tg,,Yo nunca he perdido las bragas.,Never have I ever lost my panties.,Jo mai he perdut les calces.
490,2,klk,,Yo nunca he dudado sobre mi orientación sexual.,Never have I ever doubted about my sexual orientation.,Jo mai he dubtat de la meva orientació sexual.
491,2,,,Yo nunca he cagado mientras comía.,Never have I ever shitted while eating.,Jo mai he cagat mentre menjava.
492,5,,,Yo nunca me he masturbado durante una clase telemática.,Never have I ever masturbated during a telematics class.,Jo mai m'he masturbat durant una classe telemàtica.
493,3,,,Yo nunca he hecho o recibido un oral desde debajo de una mesa.,Never have I ever did or recieved an oral from under a table.,Jo mai he rebut o fet un oral des de sota la taula.
494,4,,,Yo nunca he fumado marihuana vendida por un policía.,Never have I ever smoked pot sold by a policeman.,Jo mai he fumat maria venuda per un policia.
495,5,Juks,,Yo nunca me he masturbado durante una videollamada.,Never have I ever masturbated during a video call.,Jo mai m'he masturbat durant una videotrucada.
